{
  "schema_version": "network_simulation_input.v1",
  "simulation_input_id": "graph_valid_network_v2_input_v1",
  "job_type": "simulation.udm_network.v1",
  "network_graph_id": "graph_valid_network_v2",
  "network_graph_version": 1,
  "component_schemas": [
    {
      "component_schema_id": "udm_network_minimal_components.v1",
      "components": ["COD", "X_TSS"],
      "unit": "mg/L"
    }
  ],
  "nodes": [
    {
      "node_id": "influent",
      "node_type": "boundary",
      "process_unit_type": "boundary",
      "component_schema_id": "udm_network_minimal_components.v1",
      "initial_conditions": { "COD": 200, "X_TSS": 120 },
      "ports": [{ "port_id": "out", "port_kind": "hydraulic_out" }],
      "model_binding": {
        "model_kind": "passive_udm",
        "reaction_enabled": false
      },
      "parameter_binding": {},
      "unit_metadata": { "volume": "m3", "concentration": "mg/L" }
    },
    {
      "node_id": "reactor",
      "node_type": "udm_reactor",
      "process_unit_type": "udm_reactor",
      "component_schema_id": "udm_network_minimal_components.v1",
      "initial_conditions": { "COD": 50, "X_TSS": 80 },
      "volume": 1000,
      "ports": [
        { "port_id": "in", "port_kind": "hydraulic_in" },
        { "port_id": "out", "port_kind": "hydraulic_out" }
      ],
      "model_binding": { "model_kind": "udm", "reaction_enabled": false },
      "parameter_binding": {},
      "unit_metadata": { "volume": "m3", "concentration": "mg/L" }
    }
  ],
  "edges": [
    {
      "edge_id": "e_influent_reactor",
      "edge_kind": "hydraulic",
      "source_node_id": "influent",
      "source_port": "out",
      "target_node_id": "reactor",
      "target_port": "in",
      "component_policy": { "mode": "all", "include": [], "exclude": [] },
      "stream_adapter": null,
      "flow_spec": { "mode": "fixed", "value": 100, "unit": "m3/d" },
      "transport_model": null
    }
  ],
  "flow_constraints": [],
  "signal_bindings": [],
  "parameters": {
    "duration_days": 1,
    "output_step_days": 0.01,
    "solver_backend": "scipy",
    "solver_method": "BDF",
    "rtol": 0.000001,
    "atol": 0.000000001
  },
  "runtime_options": {
    "strict_flow_balance": true,
    "strict_mass_balance": true,
    "profile": "network_v2"
  }
}
